[
  {
    "id": "arbaeen-nawawi-001",
    "text_ar": "إِنَّمَا الْأَعْمَالُ بِالنِّيَّاتِ، وَإِنَّمَا لِكُلِّ امْرِئٍ مَا نَوَى، فَمَنْ كَانَتْ هِجْرَتُهُ إِلَى اللَّهِ وَرَسُولِهِ فَهِجْرَتُهُ إِلَى اللَّهِ وَرَسُولِهِ، وَمَنْ كَانَتْ هِجْرَتُهُ لِدُنْيَا يُصِيبُهَا أَوِ امْرَأَةٍ يَنْكِحُهَا فَهِجْرَتُهُ إِلَى مَا هَاجَرَ إِلَيْهِ",
    "narrator": "عمر بن الخطاب رضي الله عنه",
    "graded_by": ["البخاري", "مسلم"],
    "sources": [
      { "book": "صحيح البخاري", "number": "1" },
      { "book": "صحيح مسلم", "number": "1907" }
    ],
    "grade": "sahih",
    "agreed_upon": true,
    "category": "authentic",
    "topics": ["النية", "الإخلاص"],
    "editor_note": "مسودة للتجربة. طابق النص والأرقام بمصدر مرخّص قبل الاعتماد.",
    "review_status": "draft"
  }
]
